{
  "cache_key": "cache_async_0000000000000000",
  "is_cached": false,
  "last_refresh": "2026-04-21T12:00:05Z",
  "timezone": "UTC",
  "clickhouse": "",
  "columns": [],
  "types": [],
  "results": [],
  "hasMore": false,
  "hogql": "",
  "query_status": {
    "id": "0193a000-0000-0000-0000-000000000001",
    "team_id": 999999,
    "complete": false,
    "error": false,
    "error_message": null,
    "start_time": "2026-04-21T12:00:00Z",
    "end_time": null,
    "expiration_time": "2026-04-21T13:00:00Z",
    "task_id": "posthog.tasks.query.execute_process_query-0193a000",
    "labels": [],
    "query_progress": {
      "bytes_read": 1024000,
      "rows_read": 12345,
      "estimated_rows_total": 12345,
      "time_elapsed": 1,
      "active_cpu_time": 0,
      "task_id": "posthog.tasks.query.execute_process_query-0193a000"
    }
  },
  "modifiers": {},
  "timings": []
}
